{
  "@context": "https://schema.org",
  "@type": "ItemList",
  "name": "Law Relationship Types",
  "description": "Types of relationships between laws",
  "itemListElement": [
    {
      "identifier": "complements",
      "name": "Complements",
      "description": "Works alongside, covers related area",
      "emoji": "ü§ù"
    },
    {
      "identifier": "conflicts_with",
      "name": "Conflicts with",
      "description": "Creates legal tension or contradiction",
      "emoji": "‚öîÔ∏è"
    },
    {
      "identifier": "implements",
      "name": "Implements",
      "description": "National law implementing EU directive or regulation",
      "emoji": "üì•"
    },
    {
      "identifier": "extends",
      "name": "Extends",
      "description": "Extends scope to additional jurisdictions or areas",
      "emoji": "‚ûï"
    },
    {
      "identifier": "interprets",
      "name": "Interprets",
      "description": "Court ruling or decision interpreting the law",
      "emoji": "‚öñÔ∏è"
    },
    {
      "identifier": "succeeds",
      "name": "Succeeds",
      "description": "Replaces or succeeds previous framework",
      "emoji": "üîÑ"
    },
    {
      "identifier": "extended_by",
      "name": "Extended by",
      "description": "Law is extended by another agreement or regulation",
      "emoji": "üì§"
    }
  ]
}
